{
  "$schema": "../_schemas/page.schema.json",
  "title": "Insights",
  "description": "Notes on choosing and using industrial oils, fuels, bitumen and solvents, from the Vasant Petrochem sales desk.",
  "status": "published",
  "headline": "Insights",
  "lead": "Notes on choosing and using industrial oils, fuels, bitumen and solvents."
}
