{
  "title": "Certifications",
  "description": "The certificates Vasant Petrochem holds, with certificate numbers, issuing bodies and validity.",
  "status": "published",
  "headline": "Certifications",
  "lead": "We list only certificates we hold, each with its number, issuing body and validity, and the certificate itself."
}
