{
  "$schema": "../_schemas/page.schema.json",
  "title": "Get a quote",
  "description": "Request one quote for several industrial oils, fuels and lubricants. Add quantities, packaging and delivery, and get pricing within 24 hours.",
  "status": "published",
  "headline": "Get a quote",
  "lead": "Gather the products you need into one request. Add quantities, packaging and where it needs to go, and the sales desk replies with pricing."
}
