{
  "title": "Documents",
  "description": "Technical and safety data sheets and printable datasheets for every Vasant Petrochem product.",
  "status": "published",
  "headline": "Documents",
  "lead": "Every product has a printable datasheet built from its catalogue entry. Safety data sheets download freely as they are published; technical data sheets open after you leave your email; anything else comes with your enquiry."
}
